09:27:38.122666 IP 192.168.0.10.50748 > par10s21-in-f206.1e100.net.https: Flags [.], ack 1298126441, win 317, options [nop,nop,TS val 12542624 ecr 2129736028], length 0
09:27:38.152342 IP par10s21-in-f206.1e100.net.https > 192.168.0.10.50748: Flags [.], ack 1, win 341, options [nop,nop,TS val 2129781085 ecr 12486301], length 0
09:27:38.783239 IP 192.168.0.10.9200 > 192.168.0.254.domain: 53607+ PTR? 206.208.58.216.in-addr.arpa. (45)
09:27:38.786248 IP 192.168.0.254.domain > 192.168.0.10.9200: 53607 4/0/0 PTR par10s21-in-f206.1e100.net., PTR par10s21-in-f206.1e100.net., PTR par10s21-in-f14.1e100.net., PTR par10s21-in-f14.1e100.net. (203)
09:27:38.786456 IP 192.168.0.10.42401 > 192.168.0.254.domain: 43797+ PTR? 10.0.168.192.in-addr.arpa. (43)
09:27:38.789447 IP 192.168.0.254.domain > 192.168.0.10.42401: 43797 NXDomain* 0/0/0 (43)
09:27:39.501533 IP 192.168.0.254.mdns > 224.0.0.251.mdns: 0 [4q] A (QM)? Freebox-Server.local. SRV (QM)? 0024D47A586E@Freebox Player._raop._tcp.local. A (QM)? Freebox-Player.local. SRV (QM)? 0024D4ADD06A@Freebox Server._raop._tcp.local. (138)
09:27:39.503352 IP 192.168.0.254.mdns > 224.0.0.251.mdns: 0*- [0q] 2/0/0 (Cache flush) SRV Freebox-Server.local.:5000 0 0, (Cache flush) A 192.168.0.254 (107)
09:27:39.505211 IP 192.168.0.36.mdns > 224.0.0.251.mdns: 0*- [0q] 2/0/0 (Cache flush) A 192.168.0.36, (Cache flush) SRV Freebox-Player.local.:5000 0 0 (107)
09:27:39.681406 IP 192.168.0.10.59376 > ec2-23-23-222-225.compute-1.amazonaws.com.http: Flags [S], seq 3967852896, win 29200, options [mss 1460,sackOK,TS val 12543013 ecr 0,nop,wscale 7], length 0
09:27:39.782867 IP 192.168.0.10.20487 > 192.168.0.254.domain: 51505+ PTR? 254.0.168.192.in-addr.arpa. (44)
09:27:39.785859 IP 192.168.0.254.domain > 192.168.0.10.20487: 51505 NXDomain* 0/0/0 (44)
09:27:39.786060 IP 192.168.0.10.51215 > 192.168.0.254.domain: 27877+ PTR? 251.0.0.224.in-addr.arpa. (42)
09:27:39.797179 IP ec2-23-23-222-225.compute-1.amazonaws.com.http > 192.168.0.10.59376: Flags [S.], seq 402965346, ack 3967852897, win 17898, options [mss 8961,sackOK,TS val 4202946297 ecr 12543013,nop,wscale 8], length 0
09:27:39.797228 IP 192.168.0.10.59376 > ec2-23-23-222-225.compute-1.amazonaws.com.http: Flags [.], ack 1, win 229, options [nop,nop,TS val 12543042 ecr 4202946297], length 0
09:27:39.797515 IP 192.168.0.10.59376 > ec2-23-23-222-225.compute-1.amazonaws.com.http: Flags [P.], seq 1:976, ack 1, win 229, options [nop,nop,TS val 12543042 ecr 4202946297], length 975
09:27:39.815265 IP 192.168.0.254.domain > 192.168.0.10.51215: 27877 NXDomain 0/1/0 (99)
09:27:39.815773 IP 192.168.0.10.24175 > 192.168.0.254.domain: 53333+ PTR? 36.0.168.192.in-addr.arpa. (43)
09:27:39.818773 IP 192.168.0.254.domain > 192.168.0.10.24175: 53333 NXDomain* 0/0/0 (43)
09:27:39.819160 IP 192.168.0.10.12797 > 192.168.0.254.domain: 32812+ PTR? 225.222.23.23.in-addr.arpa. (44)
09:27:39.828614 IP 192.168.0.254.domain > 192.168.0.10.12797: 32812 1/0/0 PTR ec2-23-23-222-225.compute-1.amazonaws.com. (99)
09:27:39.920607 IP ec2-23-23-222-225.compute-1.amazonaws.com.http > 192.168.0.10.59376: Flags [.], ack 976, win 78, options [nop,nop,TS val 4202946328 ecr 12543042], length 0
09:27:39.923509 IP ec2-23-23-222-225.compute-1.amazonaws.com.http > 192.168.0.10.59376: Flags [P.], seq 1:214, ack 976, win 78, options [nop,nop,TS val 4202946329 ecr 12543042], length 213
09:27:39.923530 IP 192.168.0.10.59376 > ec2-23-23-222-225.compute-1.amazonaws.com.http: Flags [.], ack 214, win 237, options [nop,nop,TS val 12543074 ecr 4202946329], length 0

